<?xml version="1.0" encoding="UTF-8"?>
<schema 
    targetNamespace="http://theasc.com/ASCMHL" 
    elementFormDefault="qualified"
    xmlns="http://www.w3.org/2001/XMLSchema" 
    xmlns:ascmhl="http://theasc.com/ASCMHL">
    
    <simpleType name="EmailAddressAttributeType">
        <restriction base="string">
            <pattern value="[^@]+@[^\.]+\..+"/>
        </restriction>
    </simpleType>
    <simpleType name="ActionAttributeType">
        <restriction base="string">
            <enumeration value="original"/>
            <enumeration value="new"/>
            <enumeration value="verified"/>
            <enumeration value="failed"/>
        </restriction>
    </simpleType>
    <simpleType name="DirectoryAttributeType">
        <restriction base="string">
            <enumeration value="true"/>
            <enumeration value="false"/>
        </restriction>
    </simpleType>
    
    <complexType name="HashListType">
        <sequence>
            <element name="creatorinfo" type="ascmhl:CreatorInfoType"/>
            <element name="metadata" type="ascmhl:MetadataType" minOccurs="0"/>
            <element name="hashes" type="ascmhl:HashesType" minOccurs="1"/>
        </sequence>
        <attribute fixed="2" name="version" use="required"/>
    </complexType>
    <complexType name="CreatorInfoType">
        <sequence>
            <element name="creationdate" type="dateTime" maxOccurs="1" minOccurs="1"/>
            <element name="tool" type="ascmhl:ToolType" maxOccurs="1" minOccurs="1"/>
            <element name="hostname" type="string" maxOccurs="1" minOccurs="1"/>
            <element maxOccurs="unbounded" minOccurs="0" name="author" type="ascmhl:AuthorType"/>
            <element minOccurs="0" name="location"/>
            <element name="process" type="ascmhl:ProcessType" maxOccurs="1" minOccurs="1"/>
            <element name="ignore" type="ascmhl:IgnoreType" minOccurs="0"/>
        </sequence>
    </complexType>
    <complexType name="AuthorType">
        <simpleContent>
            <extension base="string">
                <attribute name="email" type="ascmhl:EmailAddressAttributeType"/>
                <attribute name="phone" type="string"/>
                <attribute name="role" type="string"/>
            </extension>
        </simpleContent>
    </complexType>
    <complexType name="ToolType">
        <simpleContent>
            <extension base="string">
                <attribute name="version" type="string"/>
            </extension>
        </simpleContent>
    </complexType>
    <complexType block="" name="ProcessType">
        <attribute name="type" use="required">
            <simpleType>
                <restriction base="string">
                    <enumeration value="in-place"/>
                    <enumeration value="transfer"/>
                </restriction>
            </simpleType>
        </attribute>
        <attribute name="hashsource" use="optional">
            <simpleType>
                <restriction base="string">
                    <enumeration value="file"/>
                    <enumeration value="source"/>
                    <enumeration value="source+file"/>
                    <enumeration value="other"/>
                </restriction>
            </simpleType>
        </attribute>
    </complexType>
    <complexType name="IgnoreType">
        <sequence>
            <element maxOccurs="unbounded" name="pattern" type="string"/>
        </sequence>
    </complexType>
    <complexType name="HashesType">
        <sequence>
            <element name="hash" type="ascmhl:HashType" maxOccurs="unbounded" minOccurs="1"/>
        </sequence>
        <attribute name="rootpath" type="string" use="required"/>
    </complexType>
    <complexType name="HashType">
        <sequence>
            <element name="path" type="string"/>
            <element name="filesize" type="int" minOccurs="0" nillable="false"/>
            <element name="lastmodificationdate" type="dateTime"/>
            <sequence maxOccurs="unbounded">
                <element name="md5" type="ascmhl:HashFormatType" minOccurs="0"/>
                <element name="sha1" type="ascmhl:HashFormatType" minOccurs="0"/>
                <element name="c4" type="ascmhl:HashFormatType" minOccurs="0"/>
                <element name="xxh32" type="ascmhl:HashFormatType" maxOccurs="1" minOccurs="0"/>
                <element name="xxh64" type="ascmhl:HashFormatType" maxOccurs="1" minOccurs="0"/>
                <element name="xxh3" type="ascmhl:HashFormatType" maxOccurs="1" minOccurs="0"/>
            </sequence>
            <element minOccurs="0" name="metadata" type="ascmhl:MetadataType"/>
        </sequence>
        <attribute name="directory" type="ascmhl:DirectoryAttributeType"/>
    </complexType>
    <complexType name="HashFormatType">
        <simpleContent>
            <extension base="string">
                <attribute name="action" type="ascmhl:ActionAttributeType"/>
            </extension>
        </simpleContent>
    </complexType>
    <complexType name="MetadataType">
        <complexContent>
            <extension base="anyType"/>
        </complexContent>
    </complexType>
    <element name="hashlist" type="ascmhl:HashListType"/>
</schema>
